{
  "$schema": "ws-content-r2.1-registry.schema.json",
  "artifactType": "IMPLEMENTATION_CONTRACT",
  "registryRevision": "ws-content-r2.1-contract-r1",
  "planningInputRevision": "s1-plan-20260824-r1",
  "targetContentRevision": "ws-content-r2.1",
  "migrationSourceRevision": "ws-content-r2",
  "activationPolicy": "NEW_RUN_ONLY",
  "contractStatus": "L0_VALIDATED",
  "storyContentPolicy": "CHAPTER_REVIEW_DEFERRED_UNTIL_P8",
  "lockedRevisions": {
    "schemaVersion": 2,
    "storyRevision": "ws-story-s1-r1",
    "budgetPolicyRevision": "budget-live-r2",
    "drawRevision": "draw-s1-r2",
    "rulesRevision": "rules-s1-r2",
    "resourcePackContract": "ws-rp-s1-r1"
  },
  "preservedRevisions": ["ws-content-r1", "ws-content-r2"],
  "authorityDocuments": [
    "DOC-AUTHORITY-001",
    "AUTHOR-DECISION-REGISTER-001",
    "PRODUCTION-DESIGN-GATE-001",
    "PRODUCTION-DATA-CLOSURE-001",
    "DATA-REVISION-002",
    "IMPLEMENTATION-HANDOFF-001",
    "CONTENT-DATA-D50-001",
    "RESEARCH-001",
    "UX-001",
    "PARTY-SYNERGY-001",
    "EVENT-DATA-D20-001",
    "EVENT-DATA-D50-001",
    "ENEMY-DATA-D50-001",
    "RESOURCE-DATA-D50-001",
    "EQUIP-DATA-D50-001",
    "FACILITY-DATA-D50-001",
    "BOSS-DATA-D50-001",
    "FINAL-DATA-001",
    "STORY-DATA-S1-001",
    "BUDGET-PROFILE-001",
    "BALANCE-CHAOS-001",
    "BALANCE-WEAPON-001",
    "BALANCE-D50-001",
    "BALANCE-MATRIX-001",
    "QA-BALANCE-001",
    "ITEM-LIST-001",
    "MATERIAL-LIST-001",
    "TOOL-LIST-001",
    "RECIPE-LIST-001",
    "SKILL-LIST-001",
    "SKILL-EFFECT-LIST-001",
    "AUG-LIST-001",
    "AUG-LIST-002",
    "AUGMENT-EFFECT-LIST-001",
    "ENEMY-ACTION-LIST-001",
    "ENTITY-LIST-001",
    "FACILITY-LIST-001",
    "COST-LIST-S1-001",
    "LOOT-LIST-001",
    "CONTENT-GRAPH-AUDIT-001"
  ],
  "targetCounts": {
    "lockFiles": 1,
    "manifestFiles": 1,
    "schemaFiles": 25,
    "dataFiles": 43,
    "totalFiles": 70,
    "seasonDays": 50,
    "materialRecords": 59,
    "nonEquipmentItems": 62,
    "equipmentAndTools": 214,
    "recipes": 316,
    "codexRecords": 335,
    "playerSkills": 64,
    "personalAugments": 50,
    "partyAugments": 16,
    "statusEffects": 21,
    "enemyActions": 69,
    "entityTemplates": 92,
    "enemyTemplates": 53,
    "supportEntities": 35,
    "facilities": 46,
    "researchNodes": 25,
    "lootTables": 62,
    "personalAugmentMilestones": 10,
    "partyAugmentMilestones": 4,
    "weaponClasses": 10,
    "seasonBosses": 4,
    "finalObjectives": 1
  },
  "workPackages": [
    "IMP-001", "IMP-002", "IMP-003", "IMP-004", "IMP-005", "IMP-006",
    "IMP-007", "IMP-008", "IMP-009", "IMP-010", "IMP-011", "IMP-012",
    "IMP-013", "IMP-014", "IMP-015", "IMP-016", "IMP-017"
  ],
  "validationGates": [
    "CONTRACT_READY",
    "BUNDLE_BUILT",
    "L0_VALIDATED",
    "L1_TESTED",
    "L2_SIMULATED",
    "L3_LOAD_TESTED",
    "RELEASE_CANDIDATE",
    "LIVE_LOCKED"
  ]
}
